{
  "schema": 1,
  "generated_at_utc": "2026-09-28T17:30:00Z",
  "device": {
    "product": "SYNTHETIC",
    "sdk": 36,
    "build_fingerprint_sha256": "1111111111111111111111111111111111111111111111111111111111111111"
  },
  "candidate_manifest_sha256": "2222222222222222222222222222222222222222222222222222222222222222",
  "decoders": [{
    "mime": "audio/example",
    "component": "c2.example.decoder",
    "decoder_discovered": true,
    "create_ok": true,
    "output_mime": "audio/raw",
    "pcm_bytes": 4096,
    "pcm_frames": 1024,
    "duration_ms": 21,
    "sample_rate": 48000,
    "channel_count": 2,
    "input_sha256": "3333333333333333333333333333333333333333333333333333333333333333",
    "pcm_sha256": "4444444444444444444444444444444444444444444444444444444444444444"
  }]
}
